{
  "format": "raiatea-learner-evidence-migration",
  "version": 1,
  "source": {
    "moduleId": "identity-fixture",
    "revision": 1,
    "stepIds": ["apply-concept", "orient-concept"]
  },
  "target": {
    "moduleId": "identity-fixture",
    "revision": 2,
    "stepIds": ["apply-concept", "enrichment-concept"]
  },
  "operations": {
    "preserve": [{"sourceStepId": "apply-concept", "targetStepId": "apply-concept"}],
    "retire": ["orient-concept"],
    "introduce": ["enrichment-concept"]
  }
}
