{
  "format": "raiatea-learner-evidence-migration",
  "version": 1,
  "source": {"moduleId": "fixture-module", "revision": 1, "stepIds": ["source-step"]},
  "target": {"moduleId": "fixture-module", "revision": 2, "stepIds": ["target-step"]},
  "operations": {
    "preserve": [
      {"sourceStepId": "source-step", "targetStepId": "target-step"}
    ],
    "retire": [],
    "introduce": []
  }
}
