{
  "format": "raiatea-learner-evidence-migration",
  "version": 1,
  "source": {
    "moduleId": "migration-context-fixture",
    "revision": 1,
    "stepIds": ["orient-concept", "legacy-practice"]
  },
  "target": {
    "moduleId": "migration-context-fixture",
    "revision": 3,
    "stepIds": ["legacy-practice", "orient-concept"]
  },
  "operations": {
    "preserve": [
      {"sourceStepId": "orient-concept", "targetStepId": "orient-concept"},
      {"sourceStepId": "legacy-practice", "targetStepId": "legacy-practice"}
    ],
    "retire": [],
    "introduce": []
  }
}
