{
  "format": "raiatea-learner-evidence-migration",
  "version": 1,
  "source": {
    "moduleId": "migration-context-fixture",
    "revision": 1,
    "stepIds": ["orient-concept", "legacy-practice", "ghost-source"]
  },
  "target": {
    "moduleId": "migration-context-fixture",
    "revision": 2,
    "stepIds": ["orient-concept", "apply-concept", "new-enrichment"]
  },
  "operations": {
    "preserve": [
      {"sourceStepId": "orient-concept", "targetStepId": "orient-concept"}
    ],
    "retire": ["legacy-practice", "ghost-source"],
    "introduce": ["apply-concept", "new-enrichment"]
  }
}
