{
  "format": "raiatea-learner-evidence-migration",
  "version": 1,
  "source": {
    "moduleId": "migration-context-fixture",
    "revision": 1,
    "stepIds": ["legacy-practice", "orient-concept"]
  },
  "target": {
    "moduleId": "migration-context-fixture",
    "revision": 2,
    "stepIds": ["new-enrichment", "apply-concept", "orient-concept"]
  },
  "operations": {
    "preserve": [
      {"sourceStepId": "orient-concept", "targetStepId": "orient-concept"}
    ],
    "retire": ["legacy-practice"],
    "introduce": ["new-enrichment", "apply-concept"]
  }
}
